{
	"contractVersion": "1.0",
	"status": "still-port",
	"source": {
		"framework": "react",
		"kind": "component",
		"files": [
			"registry/components/accordion/accordion.tsx",
			"registry/components/accordion/accordion.module.css"
		],
		"route": null,
		"animationTier": "framer-motion"
	},
	"target": {
		"kind": "component",
		"files": [
			"src/lib/components/accordion/accordion.svelte",
			"src/lib/components/accordion/accordion.types.ts",
			"src/lib/components/accordion/accordion.module.css",
			"src/site/docs/accordion.ts",
			"src/site/demos/accordion.svelte"
		],
		"route": null,
		"publicApi": {
			"props": ["items", "defaultOpen", "size"],
			"bindings": [],
			"callbacks": [],
			"snippets": ["items[].content"]
		}
	},
	"dependencies": {
		"present": ["bits-ui@2.19.3", "@lucide/svelte@1.49.0"],
		"required": [],
		"missing": [],
		"fallbacks": [
			"Phase 1: framer-motion end-states applied statically as inline style (panelStill mirror); Phase 2 swaps carrier to @humanspeak/svelte-motion without structural change"
		]
	},
	"dataFlow": {
		"loadFile": "none",
		"reason": "Presentational component with no route data.",
		"serverData": [],
		"actions": [],
		"invalidations": [],
		"serialization": "not-applicable"
	},
	"ssr": {
		"mode": "safe",
		"browserOnlyApis": [],
		"guards": [],
		"disabledReason": null
	},
	"verification": [
		{
			"command": "npm run check",
			"cwd": "svelte-arcui",
			"purpose": "svelte-check types + Svelte compile",
			"status": "passed",
			"evidence": "0 errors / 0 warnings, project-wide sweep 2026-09-30."
		},
		{
			"command": "npm run build",
			"cwd": "svelte-arcui",
			"purpose": "Production build",
			"status": "passed",
			"evidence": "vite build completed cleanly in the batch sweep alongside dialog, 2026-09-30."
		},
		{
			"command": "node scripts/cui-lint.mjs --json",
			"cwd": "svelte-arcui",
			"purpose": "Agent-coach design-system contracts",
			"status": "passed",
			"evidence": "[] — 0 violations project-wide, 2026-09-30."
		},
		{
			"command": "curl preview /components/accordion",
			"cwd": "svelte-arcui",
			"purpose": "Route serves doc HTML; specimen hydrates client-side",
			"status": "passed",
			"evidence": "HTTP 200 with doc content in SSR HTML."
		}
	],
	"gaps": [
		"API-shape: content: ReactNode -> content?: Snippet inside items (consumer-facing delta of the port, by design)",
		"Phase 1 by design: spring rotate/height animations absent; static end-states only (all phase-1 manifests carry status 'still-port' per the approved schema enum; top-level extra keys are schema-invalid, so 1-still-port is recorded here in gaps, not as a 'phase' field)",
		"bits-ui Accordion.Header default level=2 vs Radix h3: header level={3} set explicitly for DOM parity (pilot-caught; applies to every future Header port)",
		"closed panels kept mounted with inline visibility/height still-state instead of bits hiddenUntilFound (which would unblock-hide via display and block Phase 2 height springs)"
	]
}
