{
	"contractVersion": "1.0",
	"status": "still-port",
	"source": {
		"framework": "react",
		"kind": "component",
		"files": [
			"registry/components/popover/popover.tsx",
			"registry/components/popover/popover.module.css"
		],
		"route": null,
		"animationTier": "none"
	},
	"target": {
		"kind": "component",
		"files": [
			"src/lib/components/popover/popover.svelte",
			"src/lib/components/popover/popover-trigger.svelte",
			"src/lib/components/popover/popover-content.svelte",
			"src/lib/components/popover/popover-close.svelte",
			"src/lib/components/popover/index.ts",
			"src/lib/components/popover/popover.module.css"
		],
		"route": null,
		"publicApi": {
			"props": ["open", "onOpenChange", "onOpenChangeComplete", "class", "ref"],
			"bindings": ["open", "ref"],
			"callbacks": ["onOpenChange", "onOpenChangeComplete"],
			"snippets": ["children"]
		}
	},
	"dependencies": {
		"present": ["bits-ui"],
		"required": [],
		"missing": [],
		"fallbacks": []
	},
	"dataFlow": {
		"loadFile": "none",
		"reason": "Presentational overlay; no route data or load behavior.",
		"serverData": [],
		"actions": [],
		"invalidations": [],
		"serialization": "not-applicable"
	},
	"ssr": {
		"mode": "safe",
		"browserOnlyApis": [],
		"guards": [],
		"disabledReason": null
	},
	"verification": [
		{
			"command": "npm run check",
			"cwd": "svelte-arcui",
			"purpose": "svelte-check types + Svelte compile for the port and the gallery",
			"status": "passed",
			"evidence": "0 errors / 0 warnings in all popover files and the gallery (project has 1 error in a peer's src/site/demos/accordion.svelte)."
		},
		{
			"command": "node scripts/cui-lint.mjs --json",
			"cwd": "svelte-arcui",
			"purpose": "Agent-coach design-system contracts",
			"status": "passed",
			"evidence": "0 violations in src/lib/components/popover/** and src/site/**."
		},
		{
			"command": "node scripts/check-port.mjs",
			"cwd": "svelte-arcui",
			"purpose": "Per-component port gates (files, no-style, verbatim CSS, prop parity, manifest)",
			"status": "passed",
			"evidence": "popover: 0 errors, 0 warnings."
		},
		{
			"command": "npm run build",
			"cwd": "svelte-arcui",
			"purpose": "Production build",
			"status": "skipped",
			"evidence": "Blocked by a peer's broken src/site/demos/accordion.svelte (Expected token }); no popover file is involved."
		}
	],
	"gaps": [
		"Phase 1 still-port: the panel renders open with its end values; ARC's `.module.css` owns the enter/exit transitions (including `@starting-style` and the `data-state=\"closed\"` exit), so no motion-library wiring is present yet.",
		"Transform-origin CSS variable mismatch: ARC's CSS reads `var(--radix-popover-content-transform-origin)`; bits-ui sets `var(--bits-popover-content-transform-origin)`. Inert in Phase 1 (no scale animation), but Phase 2 must alias one to the other or the scale origin falls back to centre.",
		"ARC's popover is a compound module (Root/Trigger/Content/Close re-exports). The port ships one Svelte file per part plus an `index.ts` barrel; the Root/Trigger/Close are thin pass-throughs, and the Content keeps ARC's Portal wrap and default `align`/`sideOffset`/`collisionPadding`."
	]
}
