{
	"contractVersion": "1.0",
	"status": "still-port",
	"source": {
		"framework": "react",
		"kind": "component",
		"files": [
			"registry/components/textarea/textarea.tsx",
			"registry/components/textarea/textarea.module.css"
		],
		"route": null,
		"animationTier": "framer-motion"
	},
	"target": {
		"kind": "component",
		"files": [
			"src/lib/components/textarea/textarea.svelte",
			"src/lib/components/textarea/textarea.types.ts",
			"src/lib/components/textarea/textarea.module.css",
			"src/lib/components/textarea/index.ts"
		],
		"route": null,
		"publicApi": {
			"props": ["label", "description", "error", "id", "class", "value", "ref", "rows"],
			"bindings": ["value", "ref"],
			"callbacks": [],
			"snippets": []
		}
	},
	"dependencies": {
		"present": [],
		"required": [],
		"missing": [],
		"fallbacks": []
	},
	"dataFlow": {
		"loadFile": "none",
		"reason": "Presentational multiline form field; all data arrives via props.",
		"serverData": [],
		"actions": [],
		"invalidations": [],
		"serialization": "not-applicable"
	},
	"ssr": {
		"mode": "safe",
		"browserOnlyApis": [],
		"guards": [],
		"disabledReason": null
	},
	"verification": [
		{
			"command": "node scripts/check-port.mjs",
			"cwd": "svelte-arcui",
			"purpose": "Per-component port gates (files, no-style, verbatim CSS, prop parity, manifest)",
			"status": "passed",
			"evidence": "textarea: 0 errors, 0 warnings."
		},
		{
			"command": "npm run check",
			"cwd": "svelte-arcui",
			"purpose": "svelte-check types + Svelte compile",
			"status": "passed",
			"evidence": "0 errors / 0 warnings."
		},
		{
			"command": "npm run build",
			"cwd": "svelte-arcui",
			"purpose": "Production build",
			"status": "passed",
			"evidence": "vite build completed."
		}
	],
	"gaps": [
		"Phase 1 still-port: helper/error rows render their end state; the height-open spring and word animation are Phase 2. `.messageSlot`/`.words`/`.word` are kept as the Phase 2 hooks.",
		"ARC's textarea uses no `.label` class (the module styles `.field label`), so the port's label has no class — matching the verbatim CSS."
	]
}
