{
	"contractVersion": "1.0",
	"status": "still-port",
	"source": {
		"framework": "react",
		"kind": "component",
		"files": [
			"registry/components/notification-center/notification-center.tsx",
			"registry/components/notification-center/notification-center.module.css"
		],
		"route": null,
		"animationTier": "framer-motion"
	},
	"target": {
		"kind": "component",
		"files": [
			"src/lib/components/notification-center/notification-center.svelte",
			"src/lib/components/notification-center/notification-center.types.ts",
			"src/lib/components/notification-center/notification-center.module.css"
		],
		"route": null,
		"publicApi": {
			"props": [
				"notifications",
				"label",
				"onReadChange",
				"onDismiss",
				"open",
				"onOpenChange",
				"avoidCollisions"
			],
			"bindings": [],
			"callbacks": ["onReadChange", "onDismiss", "onOpenChange"],
			"snippets": []
		}
	},
	"dependencies": {
		"present": ["bits-ui", "@lucide/svelte"],
		"required": ["$lib/components/avatar/avatar.svelte"],
		"missing": [],
		"fallbacks": []
	},
	"dataFlow": {
		"loadFile": "none",
		"reason": "Presentational overlay fed by a `notifications` prop; no route data.",
		"serverData": [],
		"actions": [],
		"invalidations": [],
		"serialization": "not-applicable"
	},
	"ssr": {
		"mode": "browser-effect",
		"browserOnlyApis": ["requestAnimationFrame"],
		"guards": ["focus moves run inside event handlers only, never during SSR"],
		"disabledReason": null
	},
	"verification": [
		{
			"command": "npm run check",
			"cwd": "svelte-arcui",
			"purpose": "svelte-check types + Svelte compile",
			"status": "passed",
			"evidence": "Whole-project run: 0 errors / 0 warnings."
		},
		{
			"command": "npm run build",
			"cwd": "svelte-arcui",
			"purpose": "Production build",
			"status": "passed",
			"evidence": "vite build completed."
		},
		{
			"command": "node scripts/check-port.mjs",
			"cwd": "svelte-arcui",
			"purpose": "Per-component port gates",
			"status": "passed",
			"evidence": "notification-center: 0 errors, 0 warnings."
		}
	],
	"gaps": [
		"ARC ships this as a `block` (kind: block) and imports its own `Avatar`; the port therefore depends on `$lib/components/avatar/avatar.svelte`, which was ported alongside it.",
		"Phase 1 still-port: the motion helpers are static — `SwapText`/`Swap` render plain spans, `RollingCount` renders the value, `MorphWidth` is a plain span, and the AnimatePresence-driven badge/view-highlight/list/footer appear/disappear without animation. The view highlight's `layoutId` slide, the row cascade (`--index` stagger), the odometer roll and the panel enter/exit are Phase 2.",
		"The `bulk` state (which only modulated the exit cascade) is omitted in Phase 1; it returns with the motion wiring.",
		"ARC's `.panel` reads `var(--radix-popover-content-transform-origin)`; bits-ui sets `var(--bits-popover-content-transform-origin)` (same as the popover port). Inert in Phase 1; alias in Phase 2."
	]
}
