{"contractVersion":"1.0","status":"still-port","source":{"framework":"react","kind":"component","files":["registry/components/metric-card/metric-card.tsx","registry/components/metric-card/metric-card.module.css"],"route":null,"animationTier":"framer-motion"},"target":{"kind":"component","files":["src/lib/components/metric-card/metric-card.svelte","src/lib/components/metric-card/metric-card.types.ts","src/lib/components/metric-card/metric-card.module.css"],"route":null,"publicApi":{"props":["label","value","suffix","context","change"],"bindings":[],"callbacks":[],"snippets":[]}},"dependencies":{"present":["$lib/components/animated-counter/animated-counter.svelte"],"required":["$lib/components/animated-counter/animated-counter.svelte"],"missing":[],"fallbacks":[]},"dataFlow":{"loadFile":"none","reason":"Presentational metric summary; no route data or load behavior.","serverData":[],"actions":[],"invalidations":[],"serialization":"not-applicable"},"ssr":{"mode":"safe","browserOnlyApis":[],"guards":[],"disabledReason":null},"verification":[{"command":"npx svelte-check --tsconfig ./tsconfig.json","cwd":"svelte-arcui","purpose":"svelte-check types + Svelte compile for the port","status":"passed","evidence":"Whole-project run: 0 errors / 0 warnings."}],"gaps":["Phase 1 still-port: label, change chip, and context render as static text. The directional Swap (rise from below on increase, drop from above on decrease, blur, popLayout), the width-morph spring on the change chip (ResizeObserver + animate(width)), and the AnimatedCounter digit roll are Phase 2.","The .swap/.swapBlock/.text/.sizer hooks and data-trend (up on leading '+', down on leading '-' or U+2212, matching ARC) are kept so Phase 2 wires motion without restructuring.","Imports the PORTED AnimatedCounter ($lib/components/animated-counter/animated-counter.svelte), not the ARC one; passes animateOnView through like ARC.","Reduced-motion path is inherently satisfied in Phase 1 (static end state); Phase 2 must branch on reduced motion like ARC (fade variants, duration-0 transitions)."]}
