{
	"contractVersion": "1.0",
	"status": "still-port",
	"source": {
		"framework": "react",
		"kind": "component",
		"files": [
			"registry/components/input/input.tsx",
			"registry/components/input/input.module.css"
		],
		"route": null,
		"animationTier": "framer-motion"
	},
	"target": {
		"kind": "component",
		"files": [
			"src/lib/components/input/input.svelte",
			"src/lib/components/input/input.types.ts",
			"src/lib/components/input/input.module.css",
			"src/lib/components/input/index.ts"
		],
		"route": null,
		"publicApi": {
			"props": ["label", "description", "error", "id", "class", "value", "ref"],
			"bindings": ["value", "ref"],
			"callbacks": [],
			"snippets": []
		}
	},
	"dependencies": {
		"present": [],
		"required": [],
		"missing": [],
		"fallbacks": []
	},
	"dataFlow": {
		"loadFile": "none",
		"reason": "Presentational form field; all data arrives via props.",
		"serverData": [],
		"actions": [],
		"invalidations": [],
		"serialization": "not-applicable"
	},
	"ssr": {
		"mode": "safe",
		"browserOnlyApis": [],
		"guards": [],
		"disabledReason": null
	},
	"verification": [
		{
			"command": "node scripts/check-port.mjs",
			"cwd": "svelte-arcui",
			"purpose": "Per-component port gates (files, no-style, verbatim CSS, prop parity, manifest)",
			"status": "passed",
			"evidence": "input: 0 errors, 0 warnings."
		},
		{
			"command": "npm run check",
			"cwd": "svelte-arcui",
			"purpose": "svelte-check types + Svelte compile",
			"status": "passed",
			"evidence": "0 errors / 0 warnings."
		},
		{
			"command": "npm run build",
			"cwd": "svelte-arcui",
			"purpose": "Production build",
			"status": "passed",
			"evidence": "vite build completed."
		}
	],
	"gaps": [
		"Phase 1 still-port: the helper/error rows render their end state. The height-open spring and the word-rise/rolling-number animation are Phase 2; the `.messageSlot`, `.words` and `.word` elements are kept so Phase 2 wires motion without restructuring.",
		"`className` (React) maps to Svelte's `class`; the scaffold's extra `className` prop was dropped. The scaffold manifest shape was replaced with the output-contract schema shape."
	]
}
