{"contractVersion":"1.0","status":"still-port","source":{"framework":"react","kind":"component","files":["registry/components/animated-counter/animated-counter.tsx","registry/components/animated-counter/animated-counter.module.css"],"route":null,"animationTier":"framer-motion"},"target":{"kind":"component","files":["src/lib/components/animated-counter/animated-counter.svelte","src/lib/components/animated-counter/animated-counter.types.ts","src/lib/components/animated-counter/animated-counter.module.css"],"route":null,"publicApi":{"props":["value","label","prefix","suffix","decimals","animateOnView","locale"],"bindings":[],"callbacks":[],"snippets":[]}},"dependencies":{"present":[],"required":[],"missing":[],"fallbacks":[]},"dataFlow":{"loadFile":"none","reason":"Presentational number display; formatting is computed locally with Intl.NumberFormat, no route data.","serverData":[],"actions":[],"invalidations":[],"serialization":"not-applicable"},"ssr":{"mode":"safe","browserOnlyApis":[],"guards":[],"disabledReason":null},"verification":[{"command":"npx svelte-check --tsconfig ./tsconfig.json","cwd":"svelte-arcui","purpose":"svelte-check types + Svelte compile for the port","status":"passed","evidence":"Whole-project run: 0 errors / 0 warnings."}],"gaps":["Phase 1 still-port: renders the FINAL formatted value statically. The digit-wheel roll (Column springs, Glyph offsets, AnimatePresence width morph for added/removed places, label rise/blur swap), the animateOnView in-view roll from zero, and direction-aware odometer wrapping are Phase 2.","The digit/column DOM (.column/.sizer/.glyph), the .labelSwap/.labelText hooks, the srOnly accessible text, and tabular-nums are kept so Phase 2 wires motion without restructuring.","Reduced-motion path is inherently satisfied in Phase 1 (static end state, no travel); Phase 2 must branch transitions on useReducedMotion like ARC."]}
