{
	"contractVersion": "1.0",
	"status": "still-port",
	"source": {
		"framework": "react",
		"kind": "component",
		"files": [
			"registry/components/checkbox/checkbox.tsx",
			"registry/components/checkbox/checkbox.module.css"
		],
		"route": null,
		"animationTier": "framer-motion"
	},
	"target": {
		"kind": "component",
		"files": [
			"src/lib/components/checkbox/checkbox.svelte",
			"src/lib/components/checkbox/checkbox.types.ts",
			"src/lib/components/checkbox/checkbox.module.css"
		],
		"route": null,
		"publicApi": {
			"props": [
				"checked",
				"defaultChecked",
				"onCheckedChange",
				"label",
				"description",
				"disabled",
				"required",
				"name",
				"value",
				"form",
				"readonly",
				"class",
				"ref"
			],
			"bindings": ["checked", "ref"],
			"callbacks": ["onCheckedChange"],
			"snippets": []
		}
	},
	"dependencies": {
		"present": ["bits-ui"],
		"required": [],
		"missing": [],
		"fallbacks": []
	},
	"dataFlow": {
		"loadFile": "none",
		"reason": "Presentational control; no route data or load behavior.",
		"serverData": [],
		"actions": [],
		"invalidations": [],
		"serialization": "not-applicable"
	},
	"ssr": {
		"mode": "safe",
		"browserOnlyApis": [],
		"guards": [],
		"disabledReason": null
	},
	"verification": [
		{
			"command": "npm run check",
			"cwd": "svelte-arcui",
			"purpose": "svelte-check types + Svelte compile for the port and the gallery",
			"status": "passed",
			"evidence": "Whole-project run: 0 errors / 0 warnings."
		},
		{
			"command": "npm run build",
			"cwd": "svelte-arcui",
			"purpose": "Production build",
			"status": "passed",
			"evidence": "vite build completed: '✓ built in 3.00s'."
		},
		{
			"command": "node scripts/cui-lint.mjs --json",
			"cwd": "svelte-arcui",
			"purpose": "Agent-coach design-system contracts",
			"status": "passed",
			"evidence": "0 violations in src/lib/components/checkbox/** and src/site/**."
		},
		{
			"command": "node scripts/check-port.mjs",
			"cwd": "svelte-arcui",
			"purpose": "Per-component port gates (files, no-style, verbatim CSS, prop parity, manifest)",
			"status": "passed",
			"evidence": "checkbox: 0 errors, 0 warnings."
		}
	],
	"gaps": [
		"Phase 1 still-port: the fill (opacity/scale) and the check mark (path, pathLength, opacity) render their end values statically. The spring scale, fade and check↔dash path morph are deferred to Phase 2 (@humanspeak/svelte-motion). Reduced-motion is CSS-only and already correct.",
		"Public API keeps the Radix `checked: boolean | 'indeterminate'` union; Bits UI splits it into `checked` + `indeterminate`, so the port translates internally. `onCheckedChange` therefore emits a boolean, matching what a Radix click emits for the mixed→checked transition."
	]
}
